pmid,title,category,combined_text
41147029,Unveiling an Inverted Papilloma of the Bladder: A Case Series and Literature Review.,differential_diagnosis,"Unveiling an Inverted Papilloma of the Bladder: A Case Series and Literature Review. Bladder inverted papilloma (BIP) is a rare, benign urothelial lesion that can mimic urothelial carcinoma endoscopically but is characterized histologically by an endophytic growth of anastomosing urothelial cords without muscular invasion. We report a single-center case series of four patients managed with complete transurethral resection between January 2022 and August 2025, with the inclusion criterion being a histopathological diagnosis: a 28-year-old man with a trigonal lesion complicated by bladder perforation that healed uneventfully, a 72-year-old man in whom a small peri-orificial lesion was resected during urgent ureteric stenting and subsequently followed on a low-risk bladder cancer pathway with no recurrence at three years, an 84-year-old man with a large polypoid lesion arising near the bladder neck that was completely excised, and a 72-year-old woman with a pedunculated lateral wall mass treated by resection and single-dose intravesical mitomycin, remaining disease-free at one year. Synthesizing contemporary evidence and our experience, we highlight that accurate histopathological confirmation, complete endoscopic excision, and multidisciplinary discussion are key to management; routine intensive cystoscopic surveillance appears unnecessary for unequivocal bladder BIP, whereas selective follow-up is reasonable when pathology raises a differential of low-grade urothelial neoplasm with inverted growth or when lesions arise outside the bladder, where malignant association is higher. These findings support a pragmatic, risk-adapted follow-up strategy after complete resection."
41127465,Granulomatous prostatitis following BCG therapy presenting as a PI-RADS 5 lesion on MRI in the transitional zone: A case report.,differential_diagnosis,"Granulomatous prostatitis following BCG therapy presenting as a PI-RADS 5 lesion on MRI in the transitional zone: A case report. Granulomatous prostatitis is a rare benign inflammatory condition that may closely mimic prostate cancer on imaging. We report the case of a 71-year-old man who developed granulomatous prostatitis following intravesical <i>Bacillus</i> Calmette-Guérin (BCG) therapy for non-muscle-invasive bladder cancer. Post-treatment PSA elevation, prompted multiparametric MRI, which revealed a PI-RADS 5 lesion in the transitional zone of prostate- a rare location for such lesions. Targeted transperineal biopsy confirmed non-specific granulomatous prostatitis, with PCR analysis detecting <i>Mycobacterium tuberculosis</i> complex DNA. This case underscores the diagnostic challenge of distinguishing granulomatous prostatitis from prostate cancer, particularly in patients with a history of <i>Bacillus</i> Calmette-Guérin (BCG) therapy."
41830339,Treatment-Specific Clinical and Urinary Biomarker Signatures Associated With Response to Intravesical Botulinum Toxin A and Platelet-Rich Plasma in Bladder Pain Syndrome.,differential_diagnosis,"Treatment-Specific Clinical and Urinary Biomarker Signatures Associated With Response to Intravesical Botulinum Toxin A and Platelet-Rich Plasma in Bladder Pain Syndrome. To estimate response to intravesical onabotulinumtoxinA (BoNT-A) injection and platelet-rich plasma (PRP) therapy in females with bladder pain syndrome (BPS) without Hunner lesions, we developed and internally validated treatment-specific predictive models integrating clinical characteristics, bladder functional parameters, and urinary biomarkers. Females with BPS who underwent intravesical BoNT-A injection or PRP therapy were retrospectively analyzed. A total of 273 female patients were included in the final analysis. Multivariable logistic regression models were constructed to predict treatment response, defined as a Global Response Assessment score ≥ 2. Model discrimination was assessed using the area under the receiver operating characteristic (ROC) curve. For interpretability, nomogram visualizations and a conceptual framework are provided in the Supporting Information. The BoNT-A model demonstrated acceptable discrimination (area under the ROC curve: 0.789), whereas the PRP model showed superior discriminatory performance (area under the ROC curve: 0.895). Distinct clinical features and biomarker patterns contributed to each treatment-specific model, suggesting differential underlying mechanisms. Internal validation revealed higher observed response rates when the administered therapy matched the model-predicted higher probability of response, supporting internal model concordance. Treatment-specific models combining clinical, urodynamic, and urinary biomarker data provide mechanistic insight into heterogeneous response profiles to BoNT-A and PRP in females with BPS. While these models may inform future phenotype-guided research and prospective validation, external validation is required before broader clinical implementation."
41804641,"Inverted urothelial papilloma: Diagnostic challenges, molecular insights, and clinical implications.",differential_diagnosis,"Inverted urothelial papilloma: Diagnostic challenges, molecular insights, and clinical implications. Inverted urothelial papilloma (IUP) is a rare benign tumor of the urinary tract, most commonly arising in the bladder and characterized by an endophytic growth pattern. IUP primarily affects middle-aged and older men and typically presents with painless hematuria. IUP was first described in 1927 and recognized as an independent entity by the World Health Organization in 1973. It can be difficult to distinguish from urothelial carcinoma (UC), which can result in misdiagnosis and overtreatment. Genetic analyses have confirmed the benign nature of IUP. Activating mutations in RAS family genes (<i>HRAS, KRAS, NRAS</i>) are frequent in IUP, whereas mutations typical of UC, such as <i>FGFR3, TP53,</i> and <i>TERT</i> promoter alterations, are rare. Macroscopically, lesions are generally small, solitary, and broad-based. Histologically, IUP exhibits two architectural patterns: trabecular and glandular, which both show minimal atypia and low mitotic activity. Differentiating IUP from UC with inverted growth and benign mimickers, such as florid von Brunn's nests or cystitis cystica/glandularis, is challenging, particularly when specimen size is limited. Immunohistochemistry (KRT20, TP53, and Ki-67) may support the diagnosis but does not reliably distinguish IUP from UC in difficult cases. The standard treatment is complete transurethral resection, and recurrence rates are low. The superficial urothelial cells overlying IUP may also harbor RAS mutations, challenging the long-held assumption that these cells are morphologically and genetically normal. Future studies should investigate whether similar genetic alterations in morphologically normal urothelium occur in other urothelial tumors. This could refine understanding of early tumorigenesis and guide improved detection and risk assessment."
41762295,Medulloblastoma masquerading as tuberculous meningitis in a pediatric patient.,differential_diagnosis,"Medulloblastoma masquerading as tuberculous meningitis in a pediatric patient. Small round blue cell tumors are a heterogeneous group of aggressive pediatric neoplasms that can radiologically and clinically mimic infectious or inflammatory conditions, including tuberculous meningitis (TBM). Differentiating between these entities is crucial, as delays in diagnosis may significantly affect outcomes. An 8-year-old previously healthy boy presented with acute lower extremity weakness, inability to ambulate, and urinary retention following a recent urinary tract infection. Neurological examination revealed symmetric distal weakness and areflexia. Cerebrospinal fluid analysis showed markedly elevated protein levels without pleocytosis, consistent with albuminocytologic dissociation, and Guillain-Barré syndrome was diagnosed. Intravenous immunoglobulin therapy was initiated; however, no clinical improvement was observed. During hospitalization, the patient developed seizures and signs of increased intracranial pressure. Craniospinal magnetic resonance imaging revealed hydrocephalus and multiple contrast-enhancing lesions involving the suprasellar region, brainstem, and cerebral hemispheres. Despite extensive infectious and inflammatory workup, no alternative diagnosis was identified initially. Brain biopsy ultimately demonstrated a CD56- and synaptophysin-positive small round blue cell tumor, consistent with medulloblastoma. This case highlights a rare presentation of medulloblastoma mimicking TBM and underscores the importance of reconsidering the diagnosis in patients with atypical features or poor response to standard therapy. This case demonstrates that the extremely rare leptomeningeal spread of medulloblastoma can clinically and radiologically mimic TBM, posing a significant diagnostic challenge in pediatrics. In the absence of systemic signs of tuberculosis, lack of response to treatment, and the presence of progressive neuroimaging abnormalities, the diagnosis should be reconsidered. Early histopathological confirmation is essential to ensure the timely initiation of oncological treatment."
41730366,Loss of Methylthioadenosine Phosphorylase (MTAP) Expression: A Potentially Useful Tool for Distinguishing Sarcomatoid Urothelial Carcinoma from Inflammatory Myofibroblastic Tumor.,differential_diagnosis,"Loss of Methylthioadenosine Phosphorylase (MTAP) Expression: A Potentially Useful Tool for Distinguishing Sarcomatoid Urothelial Carcinoma from Inflammatory Myofibroblastic Tumor. Inflammatory myofibroblastic tumor (IMT) and sarcomatoid urothelial carcinoma (SarUC) can have striking histologic overlap but have significantly different prognoses and clinical management paradigms. Loss of MTAP protein expression by immunohistochemistry (IHC) serves as a useful surrogate for homozygous 9p21 deletion, a recurrent genomic alteration in urothelial carcinoma (UC). We analyzed MTAP expression by IHC in sixty-five SarUCs and twenty-seven urinary tract IMTs to evaluate its utility in navigating this challenging differential diagnosis. Overall, MTAP loss was significantly more frequent in SarUC (55%) compared to IMT (4%) (p<0.0001). Among forty-six biphasic SarUCs with independently evaluable epithelial and mesenchymal components, divergent expression patterns were frequent. The most common pattern was retention of MTAP staining in both epithelial and mesenchymal components (19/46, 41% of cases), followed by selective retention of MTAP in the epithelial component and loss in the mesenchymal component (16/46, 35% of cases). MTAP loss was observed in both the epithelial and mesenchymal components in 11/46 (24%) of SarUC cases. None of the 46 biphasic SarUC cases showed selective MTAP loss in the epithelial component but retention in the mesenchymal component. MTAP IHC was also particularly valuable in assessing clonal relationships in two challenging biphasic cases where the differential diagnosis included a collision between a non-invasive low-grade papillary UC and an IMT versus a subtle IMT-like SarUC arising in association with an overlying non-invasive low-grade papillary UC. Next-generation sequencing on a subset of cases (n=11) was useful for confirming 9p deletion in cases with MTAP loss by IHC, and for demonstrating molecular hallmarks of urothelial neoplasia thereby providing additional diagnostic support for morphologically challenging SarUC cases with IMT-like morphology. Therefore, MTAP IHC can be useful in evaluating spindle cell lesions of the urinary tract, as loss is significantly more common in SarUC than in IMT, and enriched in the mesenchymal component of biphasic SarUC. However, MTAP loss can be seen in both entities, and the diagnosis of IMT-like spindle cell tumors in the urinary tract requires careful integration of morphologic, immunohistochemical, and molecular data."
41722123,"Pharmacological potential of aqueous extract of Ononis natrix in mitigating early-life lead toxicity: behavioral, biochemical, histological, and immunohistochemical evaluation.",differential_diagnosis,"Pharmacological potential of aqueous extract of Ononis natrix in mitigating early-life lead toxicity: behavioral, biochemical, histological, and immunohistochemical evaluation. Chronic lead (Pb) exposure is a significant public health concern due to its long-term neurobehavioral and physiological effects. Decoctions and infusions of Ononis natrix have been widely used in traditional medicine for their therapeutic effects. While some studies have highlighted its rich bioactive composition and antioxidant properties, there remains a lack of comprehensive scientific research investigating its pharmacological effects. We have previously demonstrated the ameliorative effects of O. natrix against Pb toxicity. However, its protective effects during the juvenile period in mice (from 3 to 8 weeks of age), a critical stage of organ maturation, in mitigating Pb-induced damage across multiple systems, have not yet been investigated. The objective of this study is to evaluate the potential of the aqueous extract of O. natrix (AEON) against chronic Pb exposure initiated during the juvenile period, from a behavioral, biochemical, histological, and immunohistochemical perspective. A total of 48 male mice were divided into 4 groups: control group, Pb-intoxicated group via drinking water (1g/l), and 2 groups intoxicated with Pb and co-treated with AEON (100 mg/kg and 500 mg/kg) by oral gavage from day 21 until the end of the experiment. Behavioral tests were performed (Y-maze, elevated plus maze, tail suspension, splash test, open field, and rotarod). Biochemical analyses of blood were performed to evaluate alanine transaminase, aspartate aminotransferase, creatinine, and urea levels. Moreover, malondialdehyde (MDA) levels and catalase (CAT) activity were determined in the brain, liver, and kidneys. Histological analysis was performed on the liver and kidneys, as well as immunohistochemical analysis of glial fibrillary acidic protein (GFAP) in the prefrontal cortex and subregions of the hippocampus. The results showed that chronic Pb exposure induced spatial memory impairment, increased anxiety and depressive-like behavior, and motor coordination deterioration, along with an increase in MDA levels and a decrease in CAT activity in the brain. These cerebral dysfunctions were associated with high GFAP staining in both the hippocampus and prefrontal cortex. At the hepatorenal level, we observed an increase in biochemical markers, particularly hepatic markers, along with elevated oxidative stress in both the liver and kidneys, accompanied by renal and hepatic histopathological lesions. However, AEON administration improved memory, showed an anxiolytic effect, alleviated depressive-like behavior, and enhanced motor coordination. Additionally, AEON restored cerebral oxidative stress and reduced astrocytic GFAP expression. AEON also restored Pb-induced hepatorenal dysfunction, as evidenced by a reduction in biochemical markers, a decrease in MDA, and an increase in CAT activity in both the liver and kidneys, along with a restoration of hepatic and renal architecture. These effects were more pronounced in the group treated with the 500 mg/kg dose, demonstrating a dose-dependent effect. Our study demonstrated for the first time the significant therapeutic effect of AEON on all Pb- induced dysfunctions during a sensitive developmental period, highlighting its potential to mitigate the neurological and hepatorenal effects associated with this intoxication."
41554619,Central testicular lesion following varicocelectomy.,differential_diagnosis,"Central testicular lesion following varicocelectomy. Varicocelectomy is a commonly performed urologic procedure for the surgical correction of abnormal dilation of the venous pampiniform plexus draining the testicle. Of the surgical approaches, laparoscopic surgical correction is a minimally invasive approach, based on the Palomo varicocelectomy, which includes intentional ligation of the testicular artery. While common post-procedure outcomes and potential complications are well documented post-varicocelectomy, this case report and literature review details a man in his 20s who underwent a laparoscopic varicocelectomy and was subsequently found to have a central testicular lesion found on ultrasound to which MRI was performed to rule out a testicular tumour. In exploring this case, we also discuss the literature surrounding artery-sparing vs non-artery-sparing approaches. Although this imaging finding has been seen in other patients within our institution, we highlight this case to exemplify the need to differentiate incidental radiographic findings between benign and non-benign lesions."
41552101,Calyceal Diverticulum: A Cystic Lesion Mimicking a Urinary Tract Infection.,differential_diagnosis,"Calyceal Diverticulum: A Cystic Lesion Mimicking a Urinary Tract Infection. Calyceal diverticulum (CD) is an uncommon renal anomaly in children and often mimics other cystic lesions, making diagnosis challenging. We report the case of a nine-year-old boy evaluated during follow-up after an episode of acute pyelonephritis. He remained asymptomatic, with normal examination findings and appropriate growth. Renal ultrasound revealed a non-vascularized cystic lesion with heterogeneous content in the upper pole of the right kidney. Subsequent magnetic resonance imaging demonstrated communication with the collecting system, confirming the diagnosis of CD. While typically asymptomatic, CD may initially present with complications such as urinary tract infection (UTI). Identification relies on imaging modalities capable of visualizing the diverticular communication with the calyceal system. Management in pediatric patients is generally conservative, with surgical intervention reserved for recurrent infection, abscess formation, persistent pain, gross hematuria, or progressive enlargement. This case highlights that UTI is a complication of calyceal diverticulum and could be its first clinical manifestation. It further emphasizes the importance of including CD in the differential diagnosis of atypical pediatric renal cystic lesions and reinforces the crucial role of advanced imaging in establishing a definitive diagnosis."
41551352,Secondary pelvic hydatid cyst of the Douglas pouch causing ureteral obstruction and acute pyelonephritis: A rare case report.,differential_diagnosis,"Secondary pelvic hydatid cyst of the Douglas pouch causing ureteral obstruction and acute pyelonephritis: A rare case report. Hydatid disease caused by <i>Echinococcus granulosus primarily affects the liver and lungs. Pelvic localization is rare, and cysts in the Douglas pouch are exceptional. Urinary tract involvement through extrinsic compression leading to hydronephrosis and pyelonephritis is exceedingly uncommon.</i> We report a 47-year-old Tunisian male with mental retardation who presented with fever, flank pain, and dysuria. Laboratory workup revealed leukocytosis and positive urine culture for <i>Escherichia coli</i>. Contrast-enhanced CT showed multiple hepatic and peritoneal hydatid cysts, the largest measuring 13 × 11 cm in the liver, and a 12 × 10 cm cyst in the Douglas pouch compressing the right ectopic ureter. This caused marked uretero-pyelo-calyceal dilatation and secondary acute pyelonephritis of the right kidney. The patient was treated with intravenous antibiotics and urinary decompression by double-J stenting, followed by albendazole and elective surgery including excision of the pelvic cyst and partial pericystectomy of hepatic lesions. Postoperative recovery was uneventful, and at 6-month follow-up the patient remained asymptomatic without recurrence. Hydatid cysts of the Douglas pouch are extremely rare and may mimic other pelvic pathologies. Involvement of the urinary tract by extrinsic compression is exceptional and can present as recurrent urinary infections or acute pyelonephritis. Imaging plays a crucial role in diagnosis, while surgery remains the mainstay of treatment, supported by antiparasitic therapy. Hydatid cysts in the Douglas pouch should be considered in the differential diagnosis of pelvic cystic lesions in endemic regions, particularly when associated with urinary tract obstruction."
41497096,A silent journey from kidney to lungs: pyelonephritis triggering septic pulmonary embolism - a rare case report from Nepal.,schistosomiasis,"A silent journey from kidney to lungs: pyelonephritis triggering septic pulmonary embolism - a rare case report from Nepal. Septic pulmonary embolism (SPE) is a rare, life-threatening condition caused by infected thrombi from extrapulmonary sites lodging in pulmonary arteries, resulting in infarction and infection. Its nonspecific presentation, including fever, cough, and chest pain, often delays diagnosis. Predisposing factors include infective endocarditis, intravascular catheters, oropharyngeal infections, and urinary tract infections. A 68-year-old female with hypertension and diabetes mellitus arrived with fever, active cough, sudden shortness of breath, and pain in her left flank. The chest computed tomography (CT) revealed bilateral lung nodules with cavitation, wedge-shaped opacities, and feeding vessel indications, all of which were suggestive of SPE. Laboratory tests revealed leukocytosis and increased C-reactive protein. <i>Klebsiella pneumoniae</i> was found in both urine and sputum cultures. The patient was given empirical broad-spectrum antibiotics and ICU care, which included mechanical ventilation. The antibiotic medication was adjusted based on culture sensitivity, resulting in gradual clinical improvement. SPE diagnosis is difficult due to vague symptoms, but can be supported by CT findings such as peripheral nodules, cavitation, wedge-shaped lesions, and feeding vessel indications. Early identification of the major illness source and the use of targeted broad-spectrum antibiotics are crucial. Differential diagnoses include tuberculosis, cancer, necrotizing pneumonia, and fungal diseases; fast cavitation and peripheral spread favor SPE. SPE should be suspected in patients with extrapulmonary infections presenting with pulmonary nodules or cavitation, particularly when CT shows feeding vessel signs. Prompt diagnosis, removal of infectious sources, and early, appropriate antibiotic therapy are essential to improve patient outcomes."
41456713,Identification of Potential Focal Segmental Glomerulosclerosis (FSGS) Through Evaluation of Parietal Epithelial Cells Status Changes Using Integrin α3 Immunostaining.,differential_diagnosis,"Identification of Potential Focal Segmental Glomerulosclerosis (FSGS) Through Evaluation of Parietal Epithelial Cells Status Changes Using Integrin α3 Immunostaining. Diagnosing primary focal segmental glomerulosclerosis (FSGS) remains challenging due to the lack of reliable biomarkers. This study investigates integrin α3 as a diagnostic biomarker to differentiate FSGS from minimal change disease (MCD) and to predict progression risk in patients with MCD. Renal biopsies were obtained from 64 patients with idiopathic nephrotic syndrome and analyzed, comprising 36 patients with MCD and 28 patients with FSGS. Integrin α3 expression and distribution were assessed via immunohistochemistry using a novel semiquantitative scoring system (Int score, 0-3). Clinical correlations were analyzed using Pearson's correlation. Receiver operating characteristic (ROC) curve analysis evaluated the diagnostic utility of the Int score and established a cutoff to stratify MCD patients at risk for FSGS progression. We found that integrin α3 was markedly upregulated in perilesional areas of FSGS glomeruli, colocalizing with Annexin A3, Claudin-1, and CD44. Focal integrin α3 overexpression was observed in 73.08% of FSGS cases vs 19.44% of MCD. In MCD, 60.62% of glomeruli scored Int 0, whereas 74.36% of FSGS scored ≥1. ROC curve analysis revealed the strong discrimination ability of the Int score (area under the curve = 0.91). The Int score correlated positively with podocyte damage, 24-hour proteinuria, and the proportion of glomeruli with segmental sclerosis and inversely with serum albumin and estimated glomerular filtration rate (eGFR). Based on the Int score, 7 patients with MCD were stratified into the high-FSGS probability group. These patients exhibited broader foot process widths and longer durations of proteinuria compared with other MCD patients. Overall, parietal epithelial cells with integrin α3 overexpression invading the glomerular tuft contribute to the sclerotic lesion. Integrin α3 expression patterns may serve as a histopathological biomarker to distinguish FSGS from MCD and identify patients initially misdiagnosed as MCD, enabling early intervention and tailored monitoring."
