pmid,title,category,combined_text
41127488,"A case of chronic bilharzia endocervicitis, mimicking cervix dysplasia, in sub-Saharan Africa.",schistosomiasis,"A case of chronic bilharzia endocervicitis, mimicking cervix dysplasia, in sub-Saharan Africa. Female genital schistosomiasis (FGS), a neglected parasitic genital infection, is a major public health problem for reproductive health in areas where schistosomiasis is endemic. The diagnosis is challenging while mimicking other cervical pathologies. We report here a case of chronic bilharzia cervicitis diagnosed through anatomical pathology examination and successfully treated with praziquantel after the patient underwent several treatments for conditions that were confused with FGS."
41099427,Schistosomiasis and ruptured ectopic pregnancy: A case report.,schistosomiasis,"Schistosomiasis and ruptured ectopic pregnancy: A case report. Schistosomiasis is a parasitic disease mainly prevalent in tropical and subtropical areas, especially in poor settings without adequate sanitation and access to clean water. It is caused by trematode parasites living within the veins of their human host, where they mate and produce fertilized eggs. The eggs are either shed into the environment through feces or urine, or are retained in host tissues where they induce inflammation and then die. The genital form is caused by <i>Schistosoma haematobium</i> and affects both the urinary and genital tracts in up to 75% of infected individuals, both male and female. Female genital schistosomiasis is a challenging and potentially lethal condition and may affect the whole genital tract leading to a wide range of urinary, sexual, and reproductive health problems. The main reasons leading women to health services are infertility and genital nonspecific symptoms including vaginal discharge, pruritus, pelvic pain, dyspareunia, and haematuria. Other severe complications caused by schistosomiasis include increased risk of HIV and HPV infection, genital ulcers, miscarriage, and ectopic pregnancy. We report in the present case study a 23-year-old female with schistosomiasis and ruptured ectopic tubal pregnancy successfully managed in a low-income setting."
41066483,"The associations between Schistosoma mansoni infection, pre-treatment symptoms, praziquantel side effects, and treatment efficacy in Ugandan school-aged children.",schistosomiasis,"The associations between Schistosoma mansoni infection, pre-treatment symptoms, praziquantel side effects, and treatment efficacy in Ugandan school-aged children. Over 240 million people have schistosomiasis. Mass drug administration (MDA) with the anthelmintic praziquantel is the cornerstone of control. Treatment side effects are commonly observed and may be associated with dying worms. Side effects have also been reported as a reason for reduced MDA uptake, potentially resulting in those most in need refusing repeated treatment. An improved understanding of the association between side effects and infection intensity, pre-treatment health, and drug efficacy, may help inform education campaigns to facilitate increased MDA uptake. Using latent class analyses, Beta regression, and dose response curves, we analysed egg and antigen parasitological data alongside health and side-effects survey data pre- and post-praziquantel-treatment from two primary schools (Bugoto Lake View (LV) and Musubi Church of God (CoG)) in Schistosoma mansoni high endemicity Ugandan villages to understand whether pre-treatment infection status or intensity were related to 1) pre-treatment symptoms, 2) post-treatment side effects, and 3) whether parasite clearance after treatment was associated with side effects. At Bugoto LV: Abdominal pain, blood-in-stool, and itching/rash symptoms were non-linearly associated with infection intensity; Diarrhoea, headache and vomiting side effects were non-linearly associated with infection intensity. At Musubi CoG: Blood-in-stool, headache, and pain-when-urinating symptoms were non-linearly associated with infection intensity; Abdominal pain, diarrhoea, and vomiting side effects were non-linearly associated with infection intensity. There was no relationship between infection status (infected/ uninfected) and symptoms or side effects at either school. No association was found between infection clearance and the presence of side effects at either school. We show no evidence that being infected predisposes someone to side effects, nor that side effects are related to treatment efficacy. Relationships between pre-treatment infection intensity and pre-treatment symptoms or post-treatment side effects varied by school suggesting unmeasured factors such as co-infections or other health conditions could impact symptom and side effect reporting."
41810683,Miracidia as main source for autofluorescence of Schistosoma mansoni eggs.,schistosomiasis,"Miracidia as main source for autofluorescence of Schistosoma mansoni eggs. Egg detection still has a role in schistosomiasis control, as a screening strategy or to provide a reference standard for the assessment of the accuracy of other diagnostic tools. The Helmintex method is highly sensitive but laborious, and several improvements of it, including automated egg detection, are currently under development. We conducted a preliminary evaluation of Schistosoma mansoni eggs' autofluorescence as a distinctive marker amid very complex fecal sediments. Eggs from mouse livers and human feces were examined under a fluorescence microscope. More intense green fluorescence (greater for miracidia than for eggshell) was consistently detected using a B-2A filter (FITC, 420-495 nm). These findings may help to improve diagnostic methods, especially with automated egg detection systems. Besides access to safe water and adequate sanitation, as well as health education and the treatment of infected individuals, laboratory diagnosis is a key measure that can help eliminate schistosomiasis as a public health problem."
41810679,Comprehensive identification and co-expression analysis of long non-coding RNAs across eight timepoints of Schistosoma mansoni life cycle.,schistosomiasis,"Comprehensive identification and co-expression analysis of long non-coding RNAs across eight timepoints of Schistosoma mansoni life cycle. Long non-coding RNAs (lncRNAs) are important regulatory molecules that can be considered potential biomarkers for schistosomiasis. However, the identification and characterisation of these molecules in such complex organism as Schistosoma mansoni, remains very challenging. This study aimed to identify novel lncRNAs in S. mansoni using RNA-seq libraries representative of six developmental stages (eggs, miracidia, sporocysts, cercariae, schistosomula, and juveniles). A pipeline for lncRNAs identification was defined and applied to 41 RNA-seq libraries of eggs, miracidia, 1-day, 5-days, 32-days sporocysts, cercariae, schistosomula, and juveniles of S. mansoni. Novel identified lncRNAs and annotated mRNAs were submitted to a weighted co-expression network analysis (WGCNA) to establish lncRNA-mRNAs correlation. We identified 1,082 novel lncRNAs, mostly presenting stage-specific expression. Co-expression analysis demonstrate that MSTRG.5305.1 can potentially target MEGs and tetraspanin, essential for juvenile worm survival, making it a promising candidate for further functional studies. These findings expand the current catalog of S. mansoni lncRNAs and provide new insights into their potential roles in parasite development and host adaptation. Further functional validation could reveal new molecular targets for schistosomiasis control."
41808355,"Prevalence, Intensity, Risk Factors, and Haematological impact of Schistosomiasis among School-Aged Children in Osun State, Nigeria.",schistosomiasis,"Prevalence, Intensity, Risk Factors, and Haematological impact of Schistosomiasis among School-Aged Children in Osun State, Nigeria. Schistosomiasis remains a major neglected tropical disease and public health concern among school-aged children in Nigeria. This study assessed the prevalence and health impacts of schistosomiasis among school children in Osun State, Nigeria. A cross-sectional survey was conducted between August 2021 and February 2022 among 507 school children aged 5-18 years from four communities. Urine (n = 507) and stool (n = 477) samples were examined for Schistosoma haematobium and Schistosoma mansoni using syringe filtration and Kato-Katz techniques, respectively. Venous blood samples were analysed for haemoglobin and serum ferritin levels. Socio-demographic characteristics and risk factors were obtained using structured questionnaires. Data were analysed using chi-square and Fisher's exact tests in SPSS v21.0, with p < 0.05 considered significant. The prevalence of urinary schistosomiasis was 18.7% (95/507), intestinal schistosomiasis 8.8% (42/477), and co-infection 3.7% (19/507). Males had significantly higher urinary schistosomiasis prevalence (23.1% vs. 14.5%; p = 0.013) and egg intensity (15.75 vs. 4.97 eggs/10 ml urine) than females. Children older than 15 years had the highest prevalence (37.5%; p = 0.001). Although children of farmers showed higher prevalence (24.2%), this was not statistically significant (p = 0.089). Infected children had significantly lower haemoglobin and serum ferritin levels compared to uninfected children (p < 0.001). Schistosomiasis remains endemic among school children in Osun State, particularly among older children and males, and is associated with anaemia and reduced iron stores. These findings support targeted mass drug administration in high-risk communities."
41777287,Green synthesis of zinc oxide (ZnO) nanoparticles using aqueous leaves extracts of <i>Artemisia annua</i>: Their characterizations and anti-parasitic activity.,schistosomiasis,"Green synthesis of zinc oxide (ZnO) nanoparticles using aqueous leaves extracts of <i>Artemisia annua</i>: Their characterizations and anti-parasitic activity. Schistosomiasis continues to affect the health and quality of life of millions worldwide. Schistosomiasis is ranked as the second most significant targeted tropical disease after malaria. Praziquantel (PZQ) is the sole medication authorized by the World Health Organization (WHO) for the treatment of schistosomiasis. The sole drug has led to the development of parasite resistance. Consequently, the pursuit of novel alternatives has been the objective of numerous researchers. The use of nanotechnology in the treatment of schistosomiasis is of paramount importance for mitigating the adverse effects associated with chemotherapy. This study evaluated the effects of green-synthesized zinc oxide nanoparticles by <i>Artemisia annua</i> on <i>Schistosoma mansoni</i>, which infected <i>Mesocricetus auratus</i> both <i>in vitro</i> and <i>in vivo</i> at various doses of 100, 50, 25, 12.5, 6.25, and 3.125 μg/ml as well as in mixtures with PZQ at concentrations of 12.5+0.4, 25+0.3, 50+0.2 and 75+0.1 μg/ml. Adult <i>S. mansoni</i> worms were subjected to <i>in vitro</i> testing in the RPMI-1640 medium for a duration of 48 hours. At a concentration of 100 μg/ml, it caused 100 % mortality after 6 hours, whereas concentrations of 50 and 25 μg/ml resulted in complete mortality after 12 hours. At a concentration of 12.5 μg/ml, praziquantel alone caused the worms to die after 24 hours, whereas praziquantel combined with ZnO nanoparticles was more effective, causing death after 18 hours. Treatment with zinc oxide nanoparticles significantly decreased both the size and number of granulomas, along with the amount of eggs in the liver tissues of hamsters. All prior studies consistently corroborated the characteristics of ZnONPs synthesized using <i>Artemisia annua</i>. The results show that in laboratory experiments, green ZnO nanoparticles combined with PZQ exhibited significant efficacy against <i>Schistosoma mansoni</i>."
41769997,"A Hidden ""Promoter"": <i>Schistosoma japonicum</i> soluble egg antigen activates MAPK/PI3K-AKT pathways and inhibits autophagy to facilitate colorectal cancer.",schistosomiasis,"A Hidden ""Promoter"": <i>Schistosoma japonicum</i> soluble egg antigen activates MAPK/PI3K-AKT pathways and inhibits autophagy to facilitate colorectal cancer. Schistosomiasis affects approximately 250 million people globally. Eggs deposited in the colon are the main culprits causing pathological damage, with soluble egg antigen (SEA) being the most significant pathogenic factor in schistosomiasis. Colorectal cancer (CRC) is the most common type of gastrointestinal carcinoma. The colorectum is a common organ affected by both CRC and schistosomiasis. Clinical reports have demonstrated a correlation between the onset and poor prognosis of CRC and <i>Schistosoma japonicum</i> infection. However, there is still a lack of experimental evidence regarding the effect of schistosomiasis japonica on CRC. In this study, we found that <i>S. japonicum</i> SEA promoted the proliferation of CRC cells in a dose-dependent manner and upregulated the expression of Ki67. Moreover, SEA enhanced the migration and epithelial-mesenchymal transition of CRC cells. RNA sequencing analysis revealed that SEA activated the MAPK and PI3K-AKT signaling pathways while inhibiting autophagy in HCT116 cells, findings that were subsequently validated by Western blotting. In the murine xenograft model, SEA promoted tumor growth, increased the expression of Ki67 and Vimentin, and activated the MAPK and PI3K-AKT signaling pathways in tumor tissues. Overall, our findings demonstrate that <i>S. japonicum</i> SEA accelerates the malignant development of CRC both <i>in vitro</i> and <i>in vivo</i>, which is linked to the suppression of autophagy and the activation of MAPK and PI3K-AKT signaling. This is the first demonstration that the <i>S. japonicum</i> SEA participates in the induction of CRC-related signaling pathways, thus providing experimental evidence for the impact of schistosomiasis in endemic areas on CRC.IMPORTANCEThis research provides crucial experimental evidence bridging clinical observations and molecular mechanisms in schistosomiasis-associated colorectal cancer (CRC). For the first time, we demonstrate that <i>S. japonicum</i> soluble egg antigen (SEA) accelerates CRC malignancy both <i>in vitro</i> and <i>in vivo</i>. Mechanistically, SEA activates the key oncogenic MAPK and PI3K-AKT signaling pathways while inhibiting autophagy. These findings establish a functional link between a specific parasitic factor and host cancer-driving pathways. This work strongly suggests that chronic exposure to SEA in endemic areas constitutes a defined biological risk factor for CRC. Ultimately, this study provides experimental evidence for elucidating the impact of <i>S. japonicum</i> infection on CRC and further deepens our understanding of the role of SEA in promoting tumor progression. Our study highlights the importance of schistosomiasis control as a potential strategy for CRC prevention in endemic regions."
41754973,Surface Charge-Dependent Targeting and Penetration of Magnetic Nanoparticles into Eggs and Adult Worms of <i>Schistosoma japonicum</i>.,schistosomiasis,"Surface Charge-Dependent Targeting and Penetration of Magnetic Nanoparticles into Eggs and Adult Worms of <i>Schistosoma japonicum</i>. <b>Background/Objectives</b>: The precise elimination of <i>Schistosoma japonicum</i> eggs within host tissues poses a significant therapeutic obstacle due to the ineffectiveness of existing drugs in penetrating the eggs' protective shields. This investigation sought to create a surface-modified magnetic nanoparticle (MNP) framework to surmount this hurdle and realize targeted theranostics for combating schistosomiasis. <b>Methods</b>: Fe<sub>3</sub>O<sub>4</sub> MNPs, MNP-NH<sub>2</sub>, and MNP-COOH were synthesized and characterized before systematically studying their interactions with parasites. The intrinsic autofluorescence of eggs and adult worms served as an optical background for the investigation. In vitro co-incubation assays, confocal microscopy, and Prussian blue staining were utilized to quantify both adsorption and internalization. The in vivo efficacy was assessed in a <i>Schistosoma japonicum</i> murine model following tail vein injection. <b>Results</b>: A pronounced surface chemistry-dependent interaction was noted. Fe<sub>3</sub>O<sub>4</sub> MNP and MNP-NH<sub>2</sub> displayed remarkable adsorption and effective internalization into eggs in vitro, while MNP-COOH exhibited limited uptake. This varying effectiveness was similarly observed in vivo, with Fe<sub>3</sub>O<sub>4</sub> MNP and MNP-NH<sub>2</sub> predominantly gathering in hepatic granulomas and effectively infiltrating deposited eggs. Within adult worms, Fe<sub>3</sub>O<sub>4</sub> MNP and MNP-COOH exhibited distribution on the tegument and within adult worms. <b>Conclusions</b>: We developed a functional MNP platform in which surface charge governs parasiticidal targeting. Among the candidates investigated, MNP-NH<sub>2</sub> proved to be the most efficient for egg-targeted theranostics. This study introduces an innovative nanotechnology-based approach for accurate diagnosis and treatment of schistosomiasis by specifically tackling the challenge of impermeable eggs."
41700425,"Prevalence, intensity and predictors of intestinal schistosomiasis among fishermen in Ilemela Municipality, Tanzania.",schistosomiasis,"Prevalence, intensity and predictors of intestinal schistosomiasis among fishermen in Ilemela Municipality, Tanzania. Fishermen are among the most at-risk goups for Schistosomiasis due to their regular contact with cercarial contaminated water. This study determined the prevalence, intensity and predictors of intestinal schistosomiasis among fishermen in Ilemela Municipality, Tanzania. An analytical cross-sectional study was conducted among fishermen in Ilemela Municipality, Tanzania. Participants were conveniently recruited. Background and risk information were collected using a semistructured questionnaire, and Kato-katz technique for stool examination. Multivariate logistic regression was used to identify predictors of infection. Among the 388 participants, 26.3% were infected with Schistosoma mansoni. The geometric mean eggs per gram of feces was 37.98 (95% CI 30.98 to 46.57). Of all infected participants, 84 (82.35%) and 18 (17.65%), had light and moderate intensity infections, respectively. Age, education, fishing frequency, toilet at the fishing area, fishing in shallow water and along the lake shore, years of fishing experience and distance to health facility were the significant predictors of infection. The study revealed a moderate prevalence of S. mansoni infection among study participants. This highlights fishermen as an untreated reservoir sustaining transmission, underscoring the need to include this group in control programs to protect this high-risk group and accelerate progress towards schistosomiasis-elimination goals."
41667069,"Heat shock protein 90 as a vital signalling hub in Schistosoma mansoni: a master regulator of stem cell proliferation, development and survival.",schistosomiasis,"Heat shock protein 90 as a vital signalling hub in Schistosoma mansoni: a master regulator of stem cell proliferation, development and survival. Heat shock protein 90s (HSP90s) are molecular chaperones often produced by cells in response to hostile conditions. Here, we characterized the importance of HSP90 to growth/development and survival of the blood fluke Schistosoma mansoni, focusing on life stages that parasitize the human host. Western blotting revealed striking HSP90 upregulation in developing schistosomula in vitro, and pharmacological assays revealed that the HSP90 inhibitors gedunin, 17-N-allylamino-17-demethoxygeldanamycin (17-AAG) and 5-(2-amino-4-chloro-7-((4-methoxy-3,5-dimethylpyridin-2-yl)methyl)-7H-pyrrolo[2,3-d]pyrimidin-5-yl)-2-methylpent-4-yn-2-ol (EC-144) profoundly attenuated the viability/development of skin schistosomula to lung and liver stages. In vitro liver stage, ex vivo adult male/female worms and eggs were also killed. Strikingly, 17-AAG and EC-144 blocked stem cell proliferation in the skin, lung and liver schistosomula, and the testicular lobes and ovaries of adult worms. Small interfering RNA-mediated knockdown of the cytoplasmic HSP90 alpha isoform 2 (Smp_072330) also attenuated stem cell proliferation and restricted schistosomulum growth, supporting the importance of this isoform. 17-AAG and EC-144 attenuated the phosphorylation of schistosomula Akt/protein kinase B, extracellular signal-regulated kinase and p38 mitogen-activated protein kinase, suggesting HSP90 regulates core 'system-based' signalling pathways in the parasite; glucose uptake was also reduced. Collectively, these novel findings highlight the importance of HSP90 to intra-mammalian schistosome life stages and identify HSP90 as a possible drug target to control human schistosomiasis."
41639698,"Clinical and epidemiological features of schistosomiasis among sub-Saharan African migrants in Barcelona, Spain: a retrospective observational study.",schistosomiasis,"Clinical and epidemiological features of schistosomiasis among sub-Saharan African migrants in Barcelona, Spain: a retrospective observational study. Schistosomiasis is a neglected tropical disease, affecting 253 million people worldwide. This study aimed to describe the clinical and epidemiological characteristics of schistosomiasis in sub-Saharan African migrants evaluated through a general screening program for imported infectious diseases at a specialized international health unit in Barcelona, Spain. We performed a retrospective observational study (2014-2023) including confirmed (defined by egg detection in stool or urine) and probable cases (identified by positive serology against Schistosoma). Data on epidemiology, clinical presentation, diagnosis, treatment, and follow-up were collected. Among 3214 screened migrants, 855 (26.6%) were diagnosed with schistosomiasis. Most were male (87%) with a median age of 21.9 years, mainly originating from Mali, Gambia, and Senegal. Only 2.2% reported symptoms, while anemia and eosinophilia were observed in 9.7% and 29.7% of cases, respectively. Parasitological confirmation was achieved in 24.9%, with the remainder diagnosed by serology alone. Abdominal ultrasound was performed in 122 patients, revealing abnormalities in 20.4%. Multivariate analysis showed that confirmed cases tended to be younger (22.4 years vs 25.8 years) and had higher frequencies of women (17.8% vs 11.3%), symptoms (5.6% vs 1.1%), eosinophilia (49.4% vs 22.5%), and ultrasound abnormalities (22.7% vs 17.8%) than probable cases. Praziquantel treatment was administered to 775 patients (90.6%). Follow-up information was available for 218 individuals (28.1%); among those, eggs persisted in 7.4% (9/122), and 84% (74/88) maintained positive serology. Schistosomiasis prevalence in this migrant population was high and mostly asymptomatic, with limited laboratory abnormalities but notable radiological findings, particularly in confirmed cases. Serology was useful diagnostically but had limited value in follow-up. Systematic screening of at-risk populations remains crucial for early detection and treatment."
41638445,Distinct quaternary reaction behavior and stable charge-transfer complex formation in Schistosoma mansoni sulfide:quinone oxidoreductase.,schistosomiasis,"Distinct quaternary reaction behavior and stable charge-transfer complex formation in Schistosoma mansoni sulfide:quinone oxidoreductase. Adults of Schistosoma mansoni reside in the mesenteric veins, where they are naturally exposed to high levels of hydrogen sulfide (H<sub>2</sub>S). S. mansoni and other intestinal parasites have adapted to this sulfide-rich environment, but the evolved mechanisms to metabolize sulfide remain unelucidated. Here we reveal that the putative sulfide:quinone oxidoreductase (SQOR) encoded by S. mansoni is indeed an SQOR, catalyzing the first step of sulfide metabolism. We demonstrated that S. mansoni SQOR (SmSQOR) is expressed in eggs, cercaria and adult stages and localized in the mitochondria. The reaction catalyzed by SmSQOR was investigated using sulfane sulfur probe 4 (SSP4) and shown to require the co-presence of sulfide, quinone, and a sulfur acceptor, indicating a quaternary complex-mediated mechanism. Unlike human and bacterial SQORs, purified SmSQOR could not reduce quinones in the presence of sulfide alone unless sulfite, cyanide, or L-cysteine (but not coenzyme A or glutathione) was provided as the sulfur acceptor. In the presence of these sulfur acceptors, SmSQOR formed a long-lived charge-transfer (CT) complex, a transient electronically coupled association between electron donor and acceptor, as indicated by a broad band around 637-755 nm in the spectrum, which was associated with a partial loss of enzyme activity. Moreover, residues critical for CT complex formation and SQOR catalysis were identified. Using SSP4, we also demonstrated that SQOR was active in S. mansoni adult, egg, and cercaria stages. Taken together, these features suggest that metabolism of sulfide proceeds differently in S. mansoni than in humans."
