pmid,title,category,combined_text
39072311,Isolated tubercular cholecystitis: A rare diagnostic challenge.,differential_diagnosis,"Isolated tubercular cholecystitis: A rare diagnostic challenge. Abdominal tuberculosis, particularly affecting the hepatobiliary system, presents a diagnostic challenge due to its rarity and its tendency to mimic neoplastic conditions. Tuberculosis of the gallbladder, especially in the absence of pulmonary infection, is exceedingly rare. We present a case of isolated tubercular cholecystitis in a 41-year-old female initially suspected to have neoplastic etiology. Radiological imaging revealed thickened gallbladder wall with heterogenous enhancement extending into the subcutaneous plane. Histopathological examination post-cholecystectomy confirmed tubercular etiology with epithelioid cell granulomas and focal necrosis, alongside the presence of acid-fast bacilli. Such cases pose diagnostic dilemmas due to overlapping clinical and radiological features with gallbladder carcinoma. This report emphasizes the importance of considering tuberculosis in differentials, particularly in endemic regions like India, even without pulmonary symptoms. Treatment involves postoperative administration of anti-tubercular drugs, with the preoperative diagnosis being challenging and rarely achieved due to the avoidance of invasive procedures like fine needle aspiration in suspected carcinoma cases. The rarity of isolated gallbladder tuberculosis underscores the necessity for comprehensive diagnostic evaluations and awareness among clinicians in endemic regions."
38699528,Bacillus Calmette-Guérin (BCG) prostato-epididymitis in a patient treated for a non-invasive urothelial cancer: A case report.,differential_diagnosis,"Bacillus Calmette-Guérin (BCG) prostato-epididymitis in a patient treated for a non-invasive urothelial cancer: A case report. The Bacillus Calmette-Guérin (BCG) used as anti-tuberculous vaccine is also a well-known therapy for superficial urothelial cancer. Local or general side effects can occur, although it is generally well tolerated. We present the case of a 65 year-old caucasian man consulting for gross hematuria and lower urinary tract symptoms. Magnetic resonance imaging (MRI) demonstrated a non-invasive urothelial carcinoma (NMIBC) and Prostate Imaging-Reporting and Data System (PIRADS) IV lesions. Transurethral resection of the bladder tumor revealed a non-invasive transitional cell carcinoma. Intravesical Bacillus Calmette Guerin (BCG) therapy was provided. After 6 intravesical instillations, the patient presented with prostato-epididymitis. Forthcoming BCG instillations were canceled, and cancer treatment was switched to epirubicine. Treatment with ethambutol, rifampicin and isoniazid was started with rapid resolution of the symptoms. Urinary and semen cultures grew <i>Mycobacterium tuberculosis</i> complex strain BCG. As prostate specific antigen (PSA) rose, prostate's biopsies were performed showing extensive necrosis boarded by granulomas without signs of malignancy. BCGitis is a rare complication in patients treated for non-invasive urothelial cancer. Several risk factors, local and systemic, should be considered prior to this immunotherapy. BCGitis (local or disseminated) or hypersensitivity reactions to BCG must be included in the differential diagnosis even if therapy was administered several years before the symptoms. Adequate treatment must be started as fast as possible to avoid serious complications."
38609832,Ultrasonic diagnosis of inflammatory myofibroblastic tumor of the urinary bladder: A case report and review of the literature.,differential_diagnosis,Ultrasonic diagnosis of inflammatory myofibroblastic tumor of the urinary bladder: A case report and review of the literature. 
41756472,Isolated nonparathyroid hormone-mediated hypercalcemia: a rare presentation of retroperitoneal sarcoidosis.,differential_diagnosis,"Isolated nonparathyroid hormone-mediated hypercalcemia: a rare presentation of retroperitoneal sarcoidosis. Non-parathyroid hormone (PTH)-mediated hypercalcemia has diverse etiologies, including granulomatous disorders such as sarcoidosis, in which extrarenal 1-α-hydroxylase activity leads to excess production of 1,25-dihydroxyvitamin D (1,25(OH)₂D). We report a rare case of sarcoidosis presenting as isolated hypercalcemia without pulmonary involvement, complicated by initially normal 1,25(OH)₂D levels and a false-negative core biopsy. A 44-year-old man with hypertension and type 2 diabetes presented with malaise, polyuria, and polydipsia. Laboratory evaluation showed severe hypercalcemia with suppressed PTH. PTH-related peptide, 25-hydroxyvitamin D, TSH, and albumin were normal. Imaging revealed no osseous lesions or lymphadenopathy. He improved with intravenous fluids, calcitonin, and zoledronic acid. Three months later, he re-presented with recurrent hypercalcemia and elevated 24-hour urinary calcium excretion. Outpatient evaluation revealed elevated 1,25(OH)₂D and retroperitoneal lymphadenopathy. Core needle biopsy was nondiagnostic, but subsequent excisional biopsies of retroperitoneal lymph node confirmed nonnecrotizing granulomatous inflammation. He was diagnosed with sarcoidosis and started on high-dose steroids, later transitioning to mycophenolate. With that treatment, calcium levels normalized quickly. This case highlights the diagnostic complexities of non-PTH-mediated hypercalcemia and underscores the importance of a comprehensive workup, including medication review, laboratory tests, radiography, and biopsy, with consideration for excisional biopsy."
41669008,When MRSA Misleads: Tuberculous Osteomyelitis of the Anterior Pelvic Bones.,differential_diagnosis,"When MRSA Misleads: Tuberculous Osteomyelitis of the Anterior Pelvic Bones. Osteomyelitis of the pubic symphysis is rare, representing less than one percent of all osteomyelitis cases, and is frequently misdiagnosed as genitourinary pathology owing to overlapping symptoms and anatomical proximity. Tuberculous involvement at this site is exceptional, and concurrent infection with methicillin-resistant Staphylococcus aureus (MRSA) remains infrequently documented. This case contributes to orthopedic literature by demonstrating how reliance on blood and pus cultures alone can delay recognition of occult mycobacterial disease in culture-discordant pelvic osteomyelitis, reinforcing the indispensable role of surgical biopsy and histopathology in guiding combined antimycobacterial and antistaphylococcal therapy. A 40-year-old South-Asian woman with hypothyroidism and recurrent urinary tract infections presented with 2 weeks of progressive suprapubic pain radiating to both lower limbs and high-grade fever. Examination revealed fever, suprapubic tenderness, and restricted bilateral hip movements. Laboratories showed neutrophilic leukocytosis and elevated C-reactive protein. Blood culture grew MRSA; urine and ultrasound-guided prepubic pus cultures were sterile. Magnetic resonance imaging confirmed bilateral pubic bone osteomyelitis, superior rami involvement, abscesses, and myositis. Symptoms persisted despite intravenous teicoplanin, prompting surgical debridement. Curetted bone histopathology demonstrated necrotizing granulomatous inflammation with acid-fast bacilli, establishing tuberculous osteomyelitis complicated by secondary MRSA bacteremia. Clinicians managing non-resolving pubic osteomyelitis must pursue tissue diagnosis for mycobacterial infection, even when pyogenic pathogens are isolated, and pus is culture-negative. Prompt initiation of anti-tubercular therapy alongside targeted antibiotics yields rapid recovery. This report advances orthopedic infectious disease practice by providing a reproducible diagnostic algorithm for polymicrobial drug-resistant pelvic sepsis, with immediate relevance to orthopedics, infectious diseases, urology, and gynecology in tuberculosis-endemic regions."
41643053,Robotic-Assisted Laparoscopic Buccal Mucosal Graft Ureteroplasty and Ureteral Reim-plantation for Repair of Complex Ureteral Strictures Using the Modular Carina™ System.,differential_diagnosis,"Robotic-Assisted Laparoscopic Buccal Mucosal Graft Ureteroplasty and Ureteral Reim-plantation for Repair of Complex Ureteral Strictures Using the Modular Carina™ System. Multifocal ureteral strictures pose significant challenges for reconstructive surgery due to their segmental distribution and the need to preserve the ureteral blood supply (1, 2). Robotic-assisted surgery, owing to its precision and minimally invasive advantages, has increasingly become a preferred approach (3). Although the da Vinci surgical system has long dominated this field, several novel robotic platforms have recently emerged with comparable safety and efficacy (4, 5). This study reports our experience with robotic-assisted laparoscopic buccal mucosal graft ureteroplasty combined with ureteral reimplantation for complex ureteral stricture repair using the modular Carina™ robotic surgical system. A 32-year-old man presented with a one-month history of flank pain and was found to have both proximal and distal ureteral strictures. Using the modular Carina™ robotic system, the procedure was performed as follows: dissection of the proximal stricture, longitudinal ureterotomy, posterior augmented anastomosis, harvesting of buccal mucosa for ventral onlay grafting; followed by dissection of the distal ureteral stricture and bladder wall and completion of a side-to-side ureterovesical anastomosis. The procedure was completed successfully without conversion, with a total operative time of 272 minutes. The patient was discharged on postoperative day 7. Histopathological examination revealed granulomatous inflammation, and anti-tuberculosis therapy was initiated. The double-J stent and nephrostomy tube were removed 2 months postoperatively. During an 8-month follow-up, the patient's symptoms resolved, imaging demonstrated improvement of hydronephrosis, renal function remained stable, and no postoperative complications were observed. Robotic-assisted reconstructive surgery for complex ureteral strictures using the modular Carina™ robotic system is technically feasible. However, larger studies with longer follow-up are required to validate these preliminary findings."
41576836,Polyarteritis nodosa with isolated organ involvement requiring resection in the genitourinary system.,schistosomiasis,"Polyarteritis nodosa with isolated organ involvement requiring resection in the genitourinary system. Polyarteritis nodosa (PAN) is a necrotizing vasculitis of medium-sized arteries that is classically described as a multisystem disease. However, PAN may rarely present with isolated organ involvement, occasionally leading to irreversible organ loss before a definitive diagnosis is established. Data on such presentations remain limited and are largely confined to isolated case reports. We retrospectively evaluated eight patients diagnosed with PAN from multiple centers, focusing on clinical presentation, imaging findings, serological results, histopathological features, treatment approaches, and outcomes. The cohort included six women and two men, with ages ranging from 25 to 76 years. Clinical presentation was highly heterogeneous and frequently dominated by life-threatening genitourinary events, including massive renal hemorrhage, retroperitoneal hematoma, renovascular disease with aneurysm formation and infarction, and acute testicular pain and swelling. Five of the eight patients were classified as having isolated, single-organ PAN, predominantly involving the kidney and, less frequently, the testis. In these patients, organ loss was often the event that led to definitive diagnosis. Imaging findings supported vascular patterns consistent with PAN, including hematoma, arterial stenosis, aneurysmal changes, and ischemic sequelae. Serological evaluation was largely nondiagnostic, with predominant ANCA negativity. Histopathological examination consistently demonstrated necrotizing arteritis of medium-sized arteries with fibrinoid necrosis, thrombosis, and transmural inflammation, without glomerular or granulomatous involvement. Multisystem disease was identified in three patients, including one fatal presentation diagnosed at autopsy. This multicenter case series highlights isolated-organ PAN as a rare but clinically significant presentation, frequently recognized only after catastrophic vascular complications result in resection. Our findings emphasize the pivotal role of surgical pathology and clinicopathological correlation in establishing the diagnosis and underscore the need to consider PAN in unexplained renal or testicular vascular catastrophes, even in the absence of classic systemic features."
41250779,Xanthogranulomatous Pyelonephritis in the Tropics.,malakoplakia,"Xanthogranulomatous Pyelonephritis in the Tropics. Xanthogranulomatous pyelonephritis (XGP) is a rare inflammatory disease caused by chronic urinary tract obstruction or suppuration that occurs in the renal parenchyma. It results in an enlarged, nonfunctioning kidney with diffuse parenchymal damage due to obstructive renal calculi and granulomatous inflammation. Differentiating XGP from renal cell carcinoma, renal tuberculosis, and pyonephrosis can be challenging both clinically and radiologically; therefore, histological investigation after nephrectomy is typically used to confirm the diagnosis. We aimed to study the clinicopathological features of XGP cases confirmed by histopathological examination following surgery. This was a retrospective analysis conducted on 55 nephrectomy specimens diagnosed as XGP over a period of 6.25 years. Clinical details, laboratory and radiological findings were retrieved from the Hospital Information System. The gross and microscopic findings were reviewed. The study included 55 cases, ranging from 6 to 73 years (mean 38 ±18.3 years). The right kidney was involved in 45.5% of patients, and the left was affected in 54.5%. The most common presenting complaint was lumbar/flank pain, followed by recurrent urinary tract infection, fever, hydronephrosis, and an abdominal mass. Surgical interventions included simple nephrectomy (n=48), nephroureterectomy (n=4), radical nephrectomy (n=2), and partial nephrectomy (n=1). Renal/ureteric stones were identified in 49 cases. After histopathological analysis, 40 patients were diagnosed with pure XGPN, 7 with associated chronic pyelonephritis, 3 with hydronephrosis, 2 with pyonephrosis, 1 with nephrocutaneous fistula, 1 with high-grade urothelial carcinoma and 1 with serositis. A positive urine culture was noted in 13 cases. Histologically, all cases revealed sheets of foamy histiocytes, along with a few multinucleated giant cells and chronic inflammation. Cases with associated chronic pyelonephritis were characterised by periglomerular fibrosis, tubular atrophy, thyroidization, and interstitial fibrosis. XGP remains an important mimicker of renal malignancy, both clinically and radiologically. Accurate histopathological diagnosis is crucial to avoid overtreatment and ensure appropriate management. Increased awareness of its clinicopathological spectrum can aid in better diagnostic accuracy and reduce unnecessary radical surgeries."
41161373,Differential toxicity of polyhexamethylene guanidine phosphate administered through intravenous injection and intratracheal instillation in Sprague-Dawley rats.,differential_diagnosis,"Differential toxicity of polyhexamethylene guanidine phosphate administered through intravenous injection and intratracheal instillation in Sprague-Dawley rats. This study investigated the median lethal dose and target organs of polyhexamethylene guanidine phosphate (PHMG-P)-an antimicrobial disinfectant-administered via single-dose intravenous injection (IV; 3.13, 6.25, or 12.5 mg/kg) and intratracheal instillation (ITI; 2, 4, or 8 mg/kg) in Sprague-Dawley rats. Alterations in serum biochemical (blood urea nitrogen, creatinine, and gamma-glutamyl transferase), hematological (reticulocyte count), and hepatic histopathological features, such as tubular dilation and atypical morphology, indicated that nephrotoxicity was induced after the 12.5 mg/kg IV. Changes in lung weight, hematological (neutrophil), and histopathological parameters, including alveolar macrophage aggregation, bronchiolar epithelium de-/regeneration, and granulomatous inflammation/pulmonary fibrosis, indicated that lung damage was induced after 8 mg/kg ITI. The acute IV LD<sub>50</sub> was 12.20 and 12.83 mg/kg in male and female rats, respectively, and the target organ was the kidney. In contrast, the acute ITI LD<sub>50</sub> was 5.68 and 5.01 mg/kg in male and female rats, respectively, and the target organ was the lung. This study indicates that PHMG-P exerts varying toxic effects depending on the route of administration."
41159347,Xanthogranulomatous Pyelonephritis in a Socioeconomically Disadvantaged Immigrant Child: A Case Report.,atypical_malakoplakia,"Xanthogranulomatous Pyelonephritis in a Socioeconomically Disadvantaged Immigrant Child: A Case Report. Xanthogranulomatous pyelonephritis (XGP) is a rare, chronic inflammatory kidney disease characterized by progressive destruction of the renal parenchyma, typically associated with obstructive uropathy and nephrolithiasis. It is especially uncommon in pediatric patients and may be mistaken for malignancy or other renal infections, leading to delays in diagnosis. We present the case of a 13-year-old socioeconomically disadvantaged and immigrant (SDI) girl who developed advanced XGP due to unmonitored renal stones and limited access to healthcare. She presented with prolonged fever, flank pain, weight loss, and fatigue. Imaging revealed a non-functioning, enlarged right kidney with multiple staghorn calculi. Despite initial antibiotic therapy and percutaneous nephrostomy drainage, her condition progressed, necessitating nephrectomy. Histopathological examination confirmed XGP with lipid-laden macrophages, granulomatous inflammation, and fibrosis. Stone analysis revealed a mixed composition, primarily calcium oxalate and apatite variants, consistent with chronic infection-related calculi. This case highlights the potential severity of XGP when diagnosis and management are delayed, particularly in SDI populations. Clinicians should consider XGP in children presenting with recurrent urinary tract infections, renal calculi, and nonspecific systemic symptoms. Early recognition and timely surgical intervention, guided by a multidisciplinary team, are essential to prevent irreversible renal damage and reduce morbidity in pediatric patients with complicated urinary tract conditions."
40947153,Management of Acute Tubulointerstitial Nephritis.,differential_diagnosis,"Management of Acute Tubulointerstitial Nephritis. Acute tubulointerstitial nephritis (ATIN) is an important cause of acute kidney injury and acute kidney disease globally and is characterized by immune cell infiltration into the renal tubulointerstitium, causing inflammation, tubular injury, and ultimately fibrosis. Drug-induced hypersensitivity is the most common cause (>70%); however, infections and systemic autoimmune conditions are additional triggers, with a small percentage having idiopathic ATIN. Diagnosis requires a high index of suspicion as there can be significant clinical and laboratory overlaps between the various types of ATIN and other etiologies of acute kidney injury. Oligosymptomatic acute kidney injury with a lack of urinary findings is a common presentation, adding to the diagnostic challenge. Kidney biopsy is the gold standard for diagnosis. Management of ATIN focuses on promptly identifying and addressing the underlying trigger. Given that injury is primarily immune-mediated, immunosuppressive therapy has been explored extensively in the treatment of noninfectious ATIN; however, robust randomized controlled trials are lacking to guide specific treatments. With cessation of the immune trigger and prompt treatment initiation, ATIN generally has a favorable renal prognosis. However, delay in diagnosis or increased exposure to the culprit agent can result in irreversible interstitial fibrosis and CKD."
40430084,Human Herpes Virus Genotype and Immunological Gene Expression Profile in Prostate Cancer with Prominent Inflammation.,schistosomiasis,"Human Herpes Virus Genotype and Immunological Gene Expression Profile in Prostate Cancer with Prominent Inflammation. We aim to investigate the role of the <i>Herpesviridae</i> family (<i>HHV</i>) in the onset and progression of prostate cancer (PCa) and to profile the local PCa immunological status. A total of 116 ""tru-cut"" biopsies (58 PCa and 58 benign prostatic hyperplasia [BPH]) and 49 formalin-fixed paraffin-embedded (FFPE) instances of PCa were analysed using real-time qPCR and histological examination. Infection with CMV, EBV, HHV6, and HHV7 was detected in 11.5% of the ""tru-cut"" biopsies (25.9% in BPH and 6.9% in the PCa group). In the formalin-fixed paraffin-embedded (FFPE) samples, infection was detected in 69.4% of the patients, with individual rates of EBV (47%), HHV6 (38%), HHV7 (41%), CMV (2.9%), HSV2 (2.9%), and VZV (5.8%). In the HHV-infected PCa cases, the histopathological landscape included intratumor lymphocyte infiltration with fibrosis and necrosis, periductal chronic inflammatory reaction and granulomatous lesions with foci of abscesses and necrosis, as well as inflammatory infiltration, chronic lymphadenitis, prostatic intraepithelial atrophy (PIA), and high-grade prostatic intraepithelial neoplasia (HGPIN). The majority of HHV-infected PCa patients were predominantly classified as grade G3/G4/G5 tumours, exhibiting perineural, perivascular, and lymphovascular invasion, seminal vesicle invasion, senile vesicle amyloidosis, and lymph node metastasis. Statistical analysis demonstrated a significant association between HHV infection and PCa (χ<sup>2</sup> ≈ 20.3, df = 1, <i>p</i> < 0.0001; Fisher's exact test, <i>p</i> < 0.0001) with an odds ratio of 6.50 (95% CI: 2.80-15.12). These findings suggest that long-term HHV infection could contribute to a complicated and potentially altered immune PCa tumour environment due to inflammation. This may serve as a predictor of aggressive disease progression."
41828003,Complex Disseminated Tuberculosis with Oral and Gastrointestinal Involvement: Histopathologic and Clinical Insights.,differential_diagnosis,"Complex Disseminated Tuberculosis with Oral and Gastrointestinal Involvement: Histopathologic and Clinical Insights. <b>Background and Clinical Significance:</b> Extrapulmonary tuberculosis (TB) remains a diagnostic challenge, particularly when affecting rare sites such as the oral cavity and digestive tract. We report the case of a 55-year-old woman with disseminated (miliary) tuberculosis presenting with atypical oral lesions initially suspected to represent a malignant tumor. <b>Case Presentation:</b> The patient had a history of recurrent depressive disorder, cognitive impairment, sleep disturbances, and nicotine/alcohol dependence. She presented with painful ulcerations of the oral cavity, dysphagia, odynophagia, and glossodynia. Otolaryngologic examination revealed reduced tongue mobility and an ulceroinfiltrative lesion involving the floor of the mouth and the lower alveolar ridge. Fibroscopic evaluation confirmed infiltrative ulcerative lesions, and biopsy samples were obtained. Histopathologic examination revealed a chronic necrotizing granulomatous inflammation with multinucleated giant cells, consistent with a mycobacterial infection. Further investigations confirmed disseminated (miliary) tuberculosis with oral and digestive involvement. Antituberculous therapy was initiated; however, despite temporary stabilization, the patient's condition progressively worsened and the outcome was fatal. <b>Conclusions:</b> Oral and digestive tuberculosis, although rare, should be considered in the differential diagnosis of ulceroinfiltrative lesions of the oral cavity, particularly in patients with systemic symptoms or risk factors for TB. Early histopathologic confirmation and initiation of specific therapy are essential for favorable outcomes and prevention of misdiagnosis as malignant disease."
41822252,Ovarian Tuberculosis Mimicking Ovarian Malignancy: A Diagnostic Challenge in an Endemic Setting.,schistosomiasis,"Ovarian Tuberculosis Mimicking Ovarian Malignancy: A Diagnostic Challenge in an Endemic Setting. Ovarian tuberculosis is a rare manifestation of extrapulmonary tuberculosis and may closely resemble advanced ovarian carcinoma due to overlapping clinical, biochemical, and radiological features. We report the case of an 18-year-old female who presented with progressive abdominal distension, severe hypogastric pain, and unintentional weight loss. Imaging revealed a left adnexal mass with ascites and retroperitoneal lymphadenopathy suggestive of stage IIIC ovarian carcinoma. Serum CA-125 was markedly elevated (637.4 U/mL). Prior to initiation of chemotherapy, an image-guided TRUCUT biopsy demonstrated chronic granulomatous inflammation with acid-fast bacilli. Ziehl-Neelsen staining was positive, QuantiFERON-TB Gold assay was positive, and culture of the adnexal lesion confirmed <i>Mycobacterium tuberculosis</i>. The patient was treated with first-line anti-tuberculous therapy and showed clinical and radiological improvement. This case highlights the importance of considering tuberculosis in the differential diagnosis of adnexal masses with elevated CA-125, particularly in endemic regions, and emphasizes the value of histopathological confirmation to prevent misdiagnosis and avoid unnecessary oncologic treatment."
